{
  "$schema": "./settings_ui.schema.json",
  "schema_version": "1.1",
  "navigation": {
    "root": [
      "driving",
      "interface",
      "vehicle",
      "system"
    ]
  },
  "panels": [
    {
      "id": "steering",
      "label": "Steering",
      "icon": "steering_wheel",
      "order": 1,
      "remote_configurable": true,
      "description": "Lateral control, lane changes, and steering behavior",
      "sections": [
        {
          "id": "mads",
          "title": "Modular Assistive Driving System (MADS)",
          "description": "",
          "items": [
            {
              "key": "Mads",
              "widget": "toggle",
              "requires_attestation": true,
              "title": "Enable Modular Assistive Driving System (MADS)",
              "description": "Enable MADS. This changes how lateral assist is engaged and disengaged. Disable toggle to revert back to stock sunnypilot engagement/disengagement.",
              "enablement": [
                {
                  "type": "offroad_only"
                }
              ]
            }
          ],
          "sub_panels": [
            {
              "id": "mads_settings",
              "label": "MADS Settings",
              "trigger_key": "Mads",
              "trigger_condition": {
                "type": "param",
                "key": "Mads",
                "equals": true
              },
              "items": [
                {
                  "key": "MadsMainCruiseAllowed",
                  "widget": "toggle",
                  "requires_attestation": true,
                  "title": "Toggle with Main Cruise",
                  "description": "Allow the main cruise control to toggle MADS engagement. Note: For vehicles without LFA/LKAS button, disabling this will prevent lateral control engagement.",
                  "enablement": [
                    {
                      "type": "offroad_only"
                    },
                    {
                      "type": "not",
                      "condition": {
                        "type": "any",
                        "conditions": [
                          {
                            "type": "capability",
                            "field": "brand",
                            "equals": "rivian"
                          },
                          {
                            "type": "all",
                            "conditions": [
                              {
                                "type": "capability",
                                "field": "brand",
                                "equals": "tesla"
                              },
                              {
                                "type": "not",
                                "condition": {
                                  "type": "capability",
                                  "field": "tesla_has_vehicle_bus",
                                  "equals": true
                                }
                              }
                            ]
                          }
                        ]
                      }
                    }
                  ]
                },
                {
                  "key": "MadsUnifiedEngagementMode",
                  "widget": "toggle",
                  "requires_attestation": true,
                  "title": "Unified Engagement Mode (UEM)",
                  "description": "Engage lateral and longitudinal control with cruise control engagement. UEM changes when lateral assist starts. Note: Once lateral control is engaged via UEM, it will remain engaged until it is manually disabled via the MADS button or car shut off.",
                  "enablement": [
                    {
                      "type": "offroad_only"
                    },
                    {
                      "type": "not",
                      "condition": {
                        "type": "any",
                        "conditions": [
                          {
                            "type": "capability",
                            "field": "brand",
                            "equals": "rivian"
                          },
                          {
                            "type": "all",
                            "conditions": [
                              {
                                "type": "capability",
                                "field": "brand",
                                "equals": "tesla"
                              },
                              {
                                "type": "not",
                                "condition": {
                                  "type": "capability",
                                  "field": "tesla_has_vehicle_bus",
                                  "equals": true
                                }
                              }
                            ]
                          }
                        ]
                      }
                    }
                  ]
                },
                {
                  "key": "MadsSteeringMode",
                  "widget": "multiple_button",
                  "requires_attestation": true,
                  "title": "Steering Mode on Brake Pedal",
                  "description": "Choose how Automatic Lane Centering (ALC) behaves after the brake pedal is manually pressed in sunnypilot. Disengage is the most conservative choice; Remain Active keeps lateral assist available after braking.",
                  "options": [
                    {
                      "value": 0,
                      "label": "Remain Active",
                      "enablement": [
                        {
                          "type": "not",
                          "condition": {
                            "type": "any",
                            "conditions": [
                              {
                                "type": "capability",
                                "field": "brand",
                                "equals": "rivian"
                              },
                              {
                                "type": "all",
                                "conditions": [
                                  {
                                    "type": "capability",
                                    "field": "brand",
                                    "equals": "tesla"
                                  },
                                  {
                                    "type": "not",
                                    "condition": {
                                      "type": "capability",
                                      "field": "tesla_has_vehicle_bus",
                                      "equals": true
                                    }
                                  }
                                ]
                              }
                            ]
                          }
                        }
                      ]
                    },
                    {
                      "value": 1,
                      "label": "Pause",
                      "enablement": [
                        {
                          "type": "not",
                          "condition": {
                            "type": "any",
                            "conditions": [
                              {
                                "type": "capability",
                                "field": "brand",
                                "equals": "rivian"
                              },
                              {
                                "type": "all",
                                "conditions": [
                                  {
                                    "type": "capability",
                                    "field": "brand",
                                    "equals": "tesla"
                                  },
                                  {
                                    "type": "not",
                                    "condition": {
                                      "type": "capability",
                                      "field": "tesla_has_vehicle_bus",
                                      "equals": true
                                    }
                                  }
                                ]
                              }
                            ]
                          }
                        }
                      ]
                    },
                    {
                      "value": 2,
                      "label": "Disengage"
                    }
                  ],
                  "enablement": [
                    {
                      "type": "offroad_only"
                    }
                  ]
                }
              ]
            }
          ]
        },
        {
          "id": "blinker",
          "title": "Blinker Control",
          "description": "Lateral pause behavior during turn signals",
          "attestation_required": true,
          "items": [
            {
              "key": "BlinkerPauseLateralControl",
              "widget": "toggle",
              "title": "Pause Lateral Control with Blinker",
              "description": "Pause lateral control with blinker when traveling below the selected speed. Lateral assist resumes after the blinker ends and the post-blinker delay has elapsed.",
              "sub_items": [
                {
                  "key": "BlinkerMinLateralControlSpeed",
                  "widget": "option",
                  "title": "Minimum Speed to Pause Lateral Control",
                  "description": "Below this speed, using the blinker can temporarily pause lateral assist. Set to 0 to allow the pause at any speed.",
                  "min": 0,
                  "max": 255,
                  "step": 5,
                  "unit": {